{
 "NotebookModel": "Acer Nitro AN515-45",
 "Author": "xAlpharax",
 "EcPollInterval": 3000,
 "ReadWriteWords": true,
 "CriticalTemperature": 90,
 "FanConfigurations": [
	{
	 "ReadRegister": 19,
	 "WriteRegister": 55,
	 "MinSpeedValue": 0,
	 "MaxSpeedValue": 100,
	 "IndependentReadMinMaxValues": true,
	 "MinSpeedValueRead": 0,
	 "MaxSpeedValueRead": 6122,
	 "ResetRequired": true,
	 "FanSpeedResetValue": 50,
	 "FanDisplayName": "CPU fan",
	 "TemperatureThresholds": [
	  {
	   "UpThreshold": 50,
	   "DownThreshold": 0,
	   "FanSpeed": 0.0
	  },
	  {
	   "UpThreshold": 55,
	   "DownThreshold": 50,
	   "FanSpeed": 15.0
	  },
	  {
	   "UpThreshold": 60,
	   "DownThreshold": 55,
	   "FanSpeed": 25.0
	  },
	  {
	   "UpThreshold": 65,
	   "DownThreshold": 60,
	   "FanSpeed": 50.0
	  },
	  {
	   "UpThreshold": 70,
	   "DownThreshold": 65,
	   "FanSpeed": 60.0
	  },
	  {
	   "UpThreshold": 75,
	   "DownThreshold": 70,
	   "FanSpeed": 70.0
	  },
	  {
	   "UpThreshold": 80,
	   "DownThreshold": 75,
	   "FanSpeed": 80.0
	  },
	  {
	   "UpThreshold": 85,
	   "DownThreshold": 80,
	   "FanSpeed": 90.0
	  },
	  {
	   "UpThreshold": 90,
	   "DownThreshold": 85,
	   "FanSpeed": 100.0
	  }
	 ],
	 "FanSpeedPercentageOverrides": []
	},
	{
	 "ReadRegister": 21,
	 "WriteRegister": 58,
	 "MinSpeedValue": 0,
	 "MaxSpeedValue": 100,
	 "IndependentReadMinMaxValues": true,
	 "MinSpeedValueRead": 0,
	 "MaxSpeedValueRead": 6122,
	 "ResetRequired": true,
	 "FanSpeedResetValue": 50,
	 "FanDisplayName": "GPU fan",
	 "TemperatureThresholds": [
	  {
	   "UpThreshold": 50,
	   "DownThreshold": 0,
	   "FanSpeed": 0.0
	  },
	  {
	   "UpThreshold": 60,
	   "DownThreshold": 50,
	   "FanSpeed": 50.0
	  },
	  {
	   "UpThreshold": 70,
	   "DownThreshold": 60,
	   "FanSpeed": 75.0
	  },
	  {
	   "UpThreshold": 90,
	   "DownThreshold": 70,
	   "FanSpeed": 100.0
	  }
	 ],
	 "FanSpeedPercentageOverrides": []
	}
 ],
 "RegisterWriteConfigurations": [
	{
	 "WriteMode": "Set",
	 "WriteOccasion": "OnInitialization",
	 "Register": 34,
	 "Value": 12,
	 "ResetRequired": true,
	 "ResetValue": 4,
	 "ResetWriteMode": "Set",
	 "Description": "CPU fan manual mode"
	},
	{
	 "WriteMode": "Set",
	 "WriteOccasion": "OnInitialization",
	 "Register": 33,
	 "Value": 48,
	 "ResetRequired": true,
	 "ResetValue": 16,
	 "ResetWriteMode": "Set",
	 "Description": "GPU fan manual mode"
	},
	{
	 "WriteMode": "Set",
	 "WriteOccasion": "OnInitialization",
	 "Register": 16,
	 "Value": 0,
	 "ResetRequired": true,
	 "ResetValue": 1,
	 "ResetWriteMode": "Set",
	 "Description": "CoolBoost off"
	}
 ]
}
